anime_id,name,genre,type,episodes,rating,members,rating_10,rating_100,rating_1000
1471,City Hunter 2,"Action, Comedy, Mystery, Shounen",TV,63,8.12,8199,8.12,114.529617798305,812
518,Mahou no Princess Minky Momo,"Magic, Shoujo",TV,63,6.79,2229,6.79,91.8319384177582,679
2912,Ohayo! Spank,"Comedy, Slice of Life",TV,63,6.73,981,6.73,91.9994642506854,673
19585,Kobo-chan,"Comedy, Kids, Slice of Life",TV,63,6.72,160,6.72,92.9505575699084,672
33339,Zhongguo Jingqi Xiansheng,"Comedy, Supernatural, Thriller",ONA,63,6.96,386,6.96,102.866002460344,696
